
LR: 1e-05, Epochs: 20
=======================================================
Epoch 1: Train Acc: 0.2444, Train Loss: 1558.5510, Val Acc: 0.3878, Val Loss: 123.1765
Epoch 2: Train Acc: 0.5035, Train Loss: 1171.3731, Val Acc: 0.6028, Val Loss: 91.6281
Epoch 3: Train Acc: 0.6396, Train Loss: 920.6161, Val Acc: 0.6752, Val Loss: 76.3551
Epoch 4: Train Acc: 0.6778, Train Loss: 811.0987, Val Acc: 0.7036, Val Loss: 69.3829
Epoch 5: Train Acc: 0.6988, Train Loss: 749.6587, Val Acc: 0.7164, Val Loss: 64.7868
Epoch 6: Train Acc: 0.7123, Train Loss: 707.8536, Val Acc: 0.7256, Val Loss: 61.4349
Epoch 7: Train Acc: 0.7227, Train Loss: 668.0817, Val Acc: 0.7456, Val Loss: 56.9095
Epoch 8: Train Acc: 0.7553, Train Loss: 614.7653, Val Acc: 0.7748, Val Loss: 52.4691
Epoch 9: Train Acc: 0.7719, Train Loss: 577.7966, Val Acc: 0.7838, Val Loss: 49.6880
Epoch 10: Train Acc: 0.7813, Train Loss: 553.0578, Val Acc: 0.7918, Val Loss: 47.9229
Epoch 11: Train Acc: 0.7890, Train Loss: 534.2229, Val Acc: 0.7960, Val Loss: 46.3403
Epoch 12: Train Acc: 0.7944, Train Loss: 518.9813, Val Acc: 0.8006, Val Loss: 45.2243
Epoch 13: Train Acc: 0.7993, Train Loss: 506.0252, Val Acc: 0.8044, Val Loss: 44.4239
Epoch 14: Train Acc: 0.8035, Train Loss: 494.9246, Val Acc: 0.8070, Val Loss: 43.3939
Epoch 15: Train Acc: 0.8068, Train Loss: 485.1149, Val Acc: 0.8088, Val Loss: 42.7525
Epoch 16: Train Acc: 0.8098, Train Loss: 476.3145, Val Acc: 0.8110, Val Loss: 42.1706
Epoch 17: Train Acc: 0.8130, Train Loss: 468.3493, Val Acc: 0.8132, Val Loss: 41.5596
Epoch 18: Train Acc: 0.8155, Train Loss: 461.1747, Val Acc: 0.8148, Val Loss: 41.0742
Epoch 19: Train Acc: 0.8185, Train Loss: 454.5894, Val Acc: 0.8176, Val Loss: 40.5302
Epoch 20: Train Acc: 0.8205, Train Loss: 448.5419, Val Acc: 0.8194, Val Loss: 40.1727
=======================================================

Test Results
=======================================================
[TEST] p=0, s=0.0 | acc=0.8082, loss=86.0405
[TEST] p=0, s=0.05 | acc=0.8082, loss=86.0405
[TEST] p=0, s=0.1 | acc=0.8082, loss=86.0405
[TEST] p=0, s=0.15 | acc=0.8082, loss=86.0405
[TEST] p=0, s=0.2 | acc=0.8082, loss=86.0405
[TEST] p=0, s=0.25 | acc=0.8082, loss=86.0405
[TEST] p=0, s=0.3 | acc=0.8082, loss=86.0405
[TEST] p=0, s=0.35 | acc=0.8082, loss=86.0405
[TEST] p=0, s=0.4 | acc=0.8082, loss=86.0405
[TEST] p=25, s=0.0 | acc=0.8082, loss=86.0405
[TEST] p=25, s=0.05 | acc=0.8051, loss=86.9552
[TEST] p=25, s=0.1 | acc=0.8029, loss=88.8357
[TEST] p=25, s=0.15 | acc=0.7961, loss=91.7948
[TEST] p=25, s=0.2 | acc=0.7855, loss=96.1335
[TEST] p=25, s=0.25 | acc=0.7754, loss=100.4310
[TEST] p=25, s=0.3 | acc=0.7569, loss=105.6827
[TEST] p=25, s=0.35 | acc=0.7407, loss=111.9401
[TEST] p=25, s=0.4 | acc=0.7266, loss=116.1959
[TEST] p=50, s=0.0 | acc=0.8082, loss=86.0405
[TEST] p=50, s=0.05 | acc=0.8061, loss=87.5227
[TEST] p=50, s=0.1 | acc=0.7940, loss=92.2271
[TEST] p=50, s=0.15 | acc=0.7794, loss=98.5797
[TEST] p=50, s=0.2 | acc=0.7581, loss=107.1140
[TEST] p=50, s=0.25 | acc=0.7317, loss=117.3908
[TEST] p=50, s=0.3 | acc=0.6981, loss=128.5358
[TEST] p=50, s=0.35 | acc=0.6718, loss=138.6389
[TEST] p=50, s=0.4 | acc=0.6389, loss=148.4991
[TEST] p=75, s=0.0 | acc=0.8082, loss=86.0405
[TEST] p=75, s=0.05 | acc=0.8046, loss=88.4906
[TEST] p=75, s=0.1 | acc=0.7902, loss=94.5120
[TEST] p=75, s=0.15 | acc=0.7640, loss=104.4806
[TEST] p=75, s=0.2 | acc=0.7370, loss=115.9403
[TEST] p=75, s=0.25 | acc=0.6939, loss=131.6863
[TEST] p=75, s=0.3 | acc=0.6471, loss=148.4060
[TEST] p=75, s=0.35 | acc=0.6054, loss=163.7327
[TEST] p=75, s=0.4 | acc=0.5572, loss=179.4677
[TEST] p=100, s=0.0 | acc=0.8082, loss=86.0405
[TEST] p=100, s=0.05 | acc=0.8013, loss=89.6885
[TEST] p=100, s=0.1 | acc=0.7828, loss=97.7038
[TEST] p=100, s=0.15 | acc=0.7527, loss=110.2848
[TEST] p=100, s=0.2 | acc=0.7117, loss=127.4061
[TEST] p=100, s=0.25 | acc=0.6547, loss=148.1999
[TEST] p=100, s=0.3 | acc=0.5949, loss=168.8320
[TEST] p=100, s=0.35 | acc=0.5318, loss=190.6617
[TEST] p=100, s=0.4 | acc=0.4682, loss=211.5285
=======================================================


LR: 3e-05, Epochs: 15
=======================================================
Epoch 1: Train Acc: 0.4651, Train Loss: 1214.6242, Val Acc: 0.6806, Val Loss: 75.8758
Epoch 2: Train Acc: 0.6967, Train Loss: 752.9614, Val Acc: 0.7260, Val Loss: 60.7062
Epoch 3: Train Acc: 0.7545, Train Loss: 610.5003, Val Acc: 0.7850, Val Loss: 49.4212
Epoch 4: Train Acc: 0.7876, Train Loss: 533.0542, Val Acc: 0.8020, Val Loss: 45.2471
Epoch 5: Train Acc: 0.8023, Train Loss: 494.7905, Val Acc: 0.8114, Val Loss: 42.6742
Epoch 6: Train Acc: 0.8127, Train Loss: 468.6425, Val Acc: 0.8176, Val Loss: 41.2060
Epoch 7: Train Acc: 0.8197, Train Loss: 448.9034, Val Acc: 0.8228, Val Loss: 39.7131
Epoch 8: Train Acc: 0.8269, Train Loss: 433.5243, Val Acc: 0.8246, Val Loss: 38.6750
Epoch 9: Train Acc: 0.8319, Train Loss: 420.5617, Val Acc: 0.8306, Val Loss: 38.2566
Epoch 10: Train Acc: 0.8368, Train Loss: 409.5325, Val Acc: 0.8314, Val Loss: 37.2224
Epoch 11: Train Acc: 0.8401, Train Loss: 400.3589, Val Acc: 0.8350, Val Loss: 36.5082
Epoch 12: Train Acc: 0.8439, Train Loss: 391.8058, Val Acc: 0.8352, Val Loss: 36.0380
Epoch 13: Train Acc: 0.8471, Train Loss: 384.2087, Val Acc: 0.8376, Val Loss: 35.5145
Epoch 14: Train Acc: 0.8493, Train Loss: 377.5059, Val Acc: 0.8394, Val Loss: 35.1266
Epoch 15: Train Acc: 0.8521, Train Loss: 371.3126, Val Acc: 0.8422, Val Loss: 34.8361
=======================================================

Test Results
=======================================================
[TEST] p=0, s=0.0 | acc=0.8328, loss=74.8880
[TEST] p=0, s=0.05 | acc=0.8328, loss=74.8880
[TEST] p=0, s=0.1 | acc=0.8328, loss=74.8880
[TEST] p=0, s=0.15 | acc=0.8328, loss=74.8880
[TEST] p=0, s=0.2 | acc=0.8328, loss=74.8880
[TEST] p=0, s=0.25 | acc=0.8328, loss=74.8880
[TEST] p=0, s=0.3 | acc=0.8328, loss=74.8880
[TEST] p=0, s=0.35 | acc=0.8328, loss=74.8880
[TEST] p=0, s=0.4 | acc=0.8328, loss=74.8880
[TEST] p=25, s=0.0 | acc=0.8328, loss=74.8880
[TEST] p=25, s=0.05 | acc=0.8302, loss=75.7258
[TEST] p=25, s=0.1 | acc=0.8273, loss=77.4562
[TEST] p=25, s=0.15 | acc=0.8194, loss=80.6800
[TEST] p=25, s=0.2 | acc=0.8077, loss=85.1686
[TEST] p=25, s=0.25 | acc=0.7938, loss=89.5493
[TEST] p=25, s=0.3 | acc=0.7820, loss=95.0983
[TEST] p=25, s=0.35 | acc=0.7621, loss=101.7102
[TEST] p=25, s=0.4 | acc=0.7491, loss=106.8718
[TEST] p=50, s=0.0 | acc=0.8328, loss=74.8880
[TEST] p=50, s=0.05 | acc=0.8312, loss=76.0673
[TEST] p=50, s=0.1 | acc=0.8182, loss=80.7711
[TEST] p=50, s=0.15 | acc=0.8029, loss=87.3007
[TEST] p=50, s=0.2 | acc=0.7798, loss=95.9155
[TEST] p=50, s=0.25 | acc=0.7549, loss=106.4879
[TEST] p=50, s=0.3 | acc=0.7219, loss=118.6543
[TEST] p=50, s=0.35 | acc=0.6945, loss=128.7606
[TEST] p=50, s=0.4 | acc=0.6526, loss=142.0955
[TEST] p=75, s=0.0 | acc=0.8328, loss=74.8880
[TEST] p=75, s=0.05 | acc=0.8277, loss=76.7779
[TEST] p=75, s=0.1 | acc=0.8118, loss=83.2009
[TEST] p=75, s=0.15 | acc=0.7915, loss=92.3618
[TEST] p=75, s=0.2 | acc=0.7616, loss=104.6215
[TEST] p=75, s=0.25 | acc=0.7143, loss=121.3660
[TEST] p=75, s=0.3 | acc=0.6692, loss=139.4348
[TEST] p=75, s=0.35 | acc=0.6280, loss=155.4119
[TEST] p=75, s=0.4 | acc=0.5721, loss=173.4492
[TEST] p=100, s=0.0 | acc=0.8328, loss=74.8880
[TEST] p=100, s=0.05 | acc=0.8232, loss=78.3389
[TEST] p=100, s=0.1 | acc=0.8105, loss=85.6474
[TEST] p=100, s=0.15 | acc=0.7773, loss=98.5189
[TEST] p=100, s=0.2 | acc=0.7391, loss=115.6758
[TEST] p=100, s=0.25 | acc=0.6796, loss=138.0079
[TEST] p=100, s=0.3 | acc=0.6185, loss=159.3767
[TEST] p=100, s=0.35 | acc=0.5558, loss=183.0492
[TEST] p=100, s=0.4 | acc=0.4877, loss=206.1032
=======================================================


LR: 0.0001, Epochs: 12
=======================================================
Epoch 1: Train Acc: 0.6502, Train Loss: 833.7476, Val Acc: 0.7896, Val Loss: 47.6159
Epoch 2: Train Acc: 0.8042, Train Loss: 489.1356, Val Acc: 0.8178, Val Loss: 40.3245
Epoch 3: Train Acc: 0.8275, Train Loss: 429.1387, Val Acc: 0.8308, Val Loss: 37.3971
Epoch 4: Train Acc: 0.8413, Train Loss: 397.0885, Val Acc: 0.8394, Val Loss: 35.8508
Epoch 5: Train Acc: 0.8506, Train Loss: 374.8258, Val Acc: 0.8432, Val Loss: 34.5110
Epoch 6: Train Acc: 0.8574, Train Loss: 357.7984, Val Acc: 0.8502, Val Loss: 33.4115
Epoch 7: Train Acc: 0.8622, Train Loss: 344.4052, Val Acc: 0.8516, Val Loss: 32.9443
Epoch 8: Train Acc: 0.8683, Train Loss: 332.3723, Val Acc: 0.8568, Val Loss: 31.5763
Epoch 9: Train Acc: 0.8723, Train Loss: 322.1750, Val Acc: 0.8614, Val Loss: 31.3622
Epoch 10: Train Acc: 0.8766, Train Loss: 313.3207, Val Acc: 0.8628, Val Loss: 30.7216
Epoch 11: Train Acc: 0.8808, Train Loss: 304.5495, Val Acc: 0.8632, Val Loss: 30.3019
Epoch 12: Train Acc: 0.8845, Train Loss: 297.3292, Val Acc: 0.8640, Val Loss: 29.9377
=======================================================

Test Results
=======================================================
[TEST] p=0, s=0.0 | acc=0.8503, loss=66.1110
[TEST] p=0, s=0.05 | acc=0.8503, loss=66.1110
[TEST] p=0, s=0.1 | acc=0.8503, loss=66.1110
[TEST] p=0, s=0.15 | acc=0.8503, loss=66.1110
[TEST] p=0, s=0.2 | acc=0.8503, loss=66.1110
[TEST] p=0, s=0.25 | acc=0.8503, loss=66.1110
[TEST] p=0, s=0.3 | acc=0.8503, loss=66.1110
[TEST] p=0, s=0.35 | acc=0.8503, loss=66.1110
[TEST] p=0, s=0.4 | acc=0.8503, loss=66.1110
[TEST] p=25, s=0.0 | acc=0.8503, loss=66.1110
[TEST] p=25, s=0.05 | acc=0.8491, loss=66.9534
[TEST] p=25, s=0.1 | acc=0.8441, loss=68.7486
[TEST] p=25, s=0.15 | acc=0.8368, loss=72.1929
[TEST] p=25, s=0.2 | acc=0.8249, loss=76.8114
[TEST] p=25, s=0.25 | acc=0.8111, loss=82.2315
[TEST] p=25, s=0.3 | acc=0.7935, loss=88.4432
[TEST] p=25, s=0.35 | acc=0.7735, loss=96.0468
[TEST] p=25, s=0.4 | acc=0.7608, loss=101.6598
[TEST] p=50, s=0.0 | acc=0.8503, loss=66.1110
[TEST] p=50, s=0.05 | acc=0.8495, loss=67.1048
[TEST] p=50, s=0.1 | acc=0.8365, loss=71.8798
[TEST] p=50, s=0.15 | acc=0.8166, loss=79.7573
[TEST] p=50, s=0.2 | acc=0.7961, loss=88.4685
[TEST] p=50, s=0.25 | acc=0.7663, loss=100.8122
[TEST] p=50, s=0.3 | acc=0.7312, loss=114.2983
[TEST] p=50, s=0.35 | acc=0.7022, loss=125.0888
[TEST] p=50, s=0.4 | acc=0.6614, loss=140.7808
[TEST] p=75, s=0.0 | acc=0.8503, loss=66.1110
[TEST] p=75, s=0.05 | acc=0.8477, loss=68.0370
[TEST] p=75, s=0.1 | acc=0.8298, loss=74.7850
[TEST] p=75, s=0.15 | acc=0.8105, loss=84.1274
[TEST] p=75, s=0.2 | acc=0.7764, loss=97.3281
[TEST] p=75, s=0.25 | acc=0.7273, loss=116.6478
[TEST] p=75, s=0.3 | acc=0.6781, loss=136.0936
[TEST] p=75, s=0.35 | acc=0.6303, loss=154.9775
[TEST] p=75, s=0.4 | acc=0.5735, loss=175.1557
[TEST] p=100, s=0.0 | acc=0.8503, loss=66.1110
[TEST] p=100, s=0.05 | acc=0.8453, loss=69.1022
[TEST] p=100, s=0.1 | acc=0.8263, loss=77.0161
[TEST] p=100, s=0.15 | acc=0.7940, loss=90.3515
[TEST] p=100, s=0.2 | acc=0.7449, loss=110.6288
[TEST] p=100, s=0.25 | acc=0.6852, loss=134.4986
[TEST] p=100, s=0.3 | acc=0.6235, loss=158.4259
[TEST] p=100, s=0.35 | acc=0.5552, loss=184.0384
[TEST] p=100, s=0.4 | acc=0.4827, loss=210.6370
=======================================================


LR: 0.0003, Epochs: 10
=======================================================
Epoch 1: Train Acc: 0.7521, Train Loss: 600.0306, Val Acc: 0.8334, Val Loss: 37.7585
Epoch 2: Train Acc: 0.8407, Train Loss: 392.4198, Val Acc: 0.8476, Val Loss: 34.5144
Epoch 3: Train Acc: 0.8596, Train Loss: 349.0703, Val Acc: 0.8586, Val Loss: 31.5559
Epoch 4: Train Acc: 0.8705, Train Loss: 321.9601, Val Acc: 0.8676, Val Loss: 30.3321
Epoch 5: Train Acc: 0.8818, Train Loss: 301.0638, Val Acc: 0.8646, Val Loss: 30.1116
Epoch 6: Train Acc: 0.8878, Train Loss: 286.1967, Val Acc: 0.8696, Val Loss: 28.7816
Epoch 7: Train Acc: 0.8941, Train Loss: 273.1400, Val Acc: 0.8710, Val Loss: 28.9907
Epoch 8: Train Acc: 0.8979, Train Loss: 261.4001, Val Acc: 0.8768, Val Loss: 27.6610
Epoch 9: Train Acc: 0.9038, Train Loss: 251.1874, Val Acc: 0.8730, Val Loss: 28.5936
Epoch 10: Train Acc: 0.9072, Train Loss: 241.4105, Val Acc: 0.8728, Val Loss: 27.9681
=======================================================

Test Results
=======================================================
[TEST] p=0, s=0.0 | acc=0.8610, loss=61.9230
[TEST] p=0, s=0.05 | acc=0.8610, loss=61.9230
[TEST] p=0, s=0.1 | acc=0.8610, loss=61.9230
[TEST] p=0, s=0.15 | acc=0.8610, loss=61.9230
[TEST] p=0, s=0.2 | acc=0.8610, loss=61.9230
[TEST] p=0, s=0.25 | acc=0.8610, loss=61.9230
[TEST] p=0, s=0.3 | acc=0.8610, loss=61.9230
[TEST] p=0, s=0.35 | acc=0.8610, loss=61.9230
[TEST] p=0, s=0.4 | acc=0.8610, loss=61.9230
[TEST] p=25, s=0.0 | acc=0.8610, loss=61.9230
[TEST] p=25, s=0.05 | acc=0.8574, loss=63.0297
[TEST] p=25, s=0.1 | acc=0.8557, loss=65.0316
[TEST] p=25, s=0.15 | acc=0.8439, loss=69.2301
[TEST] p=25, s=0.2 | acc=0.8318, loss=73.9951
[TEST] p=25, s=0.25 | acc=0.8167, loss=79.7969
[TEST] p=25, s=0.3 | acc=0.7989, loss=87.4591
[TEST] p=25, s=0.35 | acc=0.7803, loss=93.8443
[TEST] p=25, s=0.4 | acc=0.7710, loss=99.5851
[TEST] p=50, s=0.0 | acc=0.8610, loss=61.9230
[TEST] p=50, s=0.05 | acc=0.8551, loss=64.2745
[TEST] p=50, s=0.1 | acc=0.8428, loss=69.4647
[TEST] p=50, s=0.15 | acc=0.8230, loss=77.7865
[TEST] p=50, s=0.2 | acc=0.8018, loss=87.0931
[TEST] p=50, s=0.25 | acc=0.7692, loss=100.0430
[TEST] p=50, s=0.3 | acc=0.7365, loss=113.7904
[TEST] p=50, s=0.35 | acc=0.7082, loss=125.6148
[TEST] p=50, s=0.4 | acc=0.6690, loss=140.8517
[TEST] p=75, s=0.0 | acc=0.8610, loss=61.9230
[TEST] p=75, s=0.05 | acc=0.8513, loss=65.1958
[TEST] p=75, s=0.1 | acc=0.8365, loss=72.9456
[TEST] p=75, s=0.15 | acc=0.8076, loss=84.3396
[TEST] p=75, s=0.2 | acc=0.7770, loss=98.4254
[TEST] p=75, s=0.25 | acc=0.7280, loss=117.6181
[TEST] p=75, s=0.3 | acc=0.6815, loss=136.2559
[TEST] p=75, s=0.35 | acc=0.6298, loss=157.5467
[TEST] p=75, s=0.4 | acc=0.5754, loss=177.7079
[TEST] p=100, s=0.0 | acc=0.8610, loss=61.9230
[TEST] p=100, s=0.05 | acc=0.8525, loss=66.2391
[TEST] p=100, s=0.1 | acc=0.8289, loss=76.3818
[TEST] p=100, s=0.15 | acc=0.7977, loss=89.9328
[TEST] p=100, s=0.2 | acc=0.7362, loss=113.5814
[TEST] p=100, s=0.25 | acc=0.6784, loss=137.3536
[TEST] p=100, s=0.3 | acc=0.6189, loss=162.5679
[TEST] p=100, s=0.35 | acc=0.5481, loss=188.7071
[TEST] p=100, s=0.4 | acc=0.4861, loss=215.0949
=======================================================


LR: 0.001, Epochs: 8
=======================================================
Epoch 1: Train Acc: 0.8003, Train Loss: 483.8814, Val Acc: 0.8570, Val Loss: 32.5159
Epoch 2: Train Acc: 0.8586, Train Loss: 350.7309, Val Acc: 0.8560, Val Loss: 31.9205
Epoch 3: Train Acc: 0.8732, Train Loss: 316.0216, Val Acc: 0.8638, Val Loss: 30.1035
Epoch 4: Train Acc: 0.8824, Train Loss: 293.2437, Val Acc: 0.8710, Val Loss: 28.9145
Epoch 5: Train Acc: 0.8902, Train Loss: 275.5505, Val Acc: 0.8722, Val Loss: 28.2954
Epoch 6: Train Acc: 0.8953, Train Loss: 263.5737, Val Acc: 0.8770, Val Loss: 27.2270
Epoch 7: Train Acc: 0.9006, Train Loss: 250.7203, Val Acc: 0.8810, Val Loss: 26.7755
Epoch 8: Train Acc: 0.9044, Train Loss: 240.2816, Val Acc: 0.8764, Val Loss: 27.2157
=======================================================

Test Results
=======================================================
[TEST] p=0, s=0.0 | acc=0.8679, loss=58.9364
[TEST] p=0, s=0.05 | acc=0.8679, loss=58.9364
[TEST] p=0, s=0.1 | acc=0.8679, loss=58.9364
[TEST] p=0, s=0.15 | acc=0.8679, loss=58.9364
[TEST] p=0, s=0.2 | acc=0.8679, loss=58.9364
[TEST] p=0, s=0.25 | acc=0.8679, loss=58.9364
[TEST] p=0, s=0.3 | acc=0.8679, loss=58.9364
[TEST] p=0, s=0.35 | acc=0.8679, loss=58.9364
[TEST] p=0, s=0.4 | acc=0.8679, loss=58.9364
[TEST] p=25, s=0.0 | acc=0.8679, loss=58.9364
[TEST] p=25, s=0.05 | acc=0.8666, loss=59.7139
[TEST] p=25, s=0.1 | acc=0.8588, loss=62.8887
[TEST] p=25, s=0.15 | acc=0.8492, loss=66.5165
[TEST] p=25, s=0.2 | acc=0.8343, loss=73.7810
[TEST] p=25, s=0.25 | acc=0.8133, loss=82.2353
[TEST] p=25, s=0.3 | acc=0.7945, loss=92.2822
[TEST] p=25, s=0.35 | acc=0.7718, loss=101.0939
[TEST] p=25, s=0.4 | acc=0.7568, loss=110.0223
[TEST] p=50, s=0.0 | acc=0.8679, loss=58.9364
[TEST] p=50, s=0.05 | acc=0.8640, loss=60.7017
[TEST] p=50, s=0.1 | acc=0.8499, loss=66.5944
[TEST] p=50, s=0.15 | acc=0.8292, loss=75.2474
[TEST] p=50, s=0.2 | acc=0.7961, loss=90.0682
[TEST] p=50, s=0.25 | acc=0.7603, loss=107.2946
[TEST] p=50, s=0.3 | acc=0.7181, loss=125.8913
[TEST] p=50, s=0.35 | acc=0.6756, loss=146.4949
[TEST] p=50, s=0.4 | acc=0.6409, loss=164.8380
[TEST] p=75, s=0.0 | acc=0.8679, loss=58.9364
[TEST] p=75, s=0.05 | acc=0.8624, loss=61.7962
[TEST] p=75, s=0.1 | acc=0.8443, loss=69.8087
[TEST] p=75, s=0.15 | acc=0.8130, loss=82.6663
[TEST] p=75, s=0.2 | acc=0.7639, loss=104.0071
[TEST] p=75, s=0.25 | acc=0.7026, loss=132.3429
[TEST] p=75, s=0.3 | acc=0.6442, loss=159.5507
[TEST] p=75, s=0.35 | acc=0.5783, loss=189.6074
[TEST] p=75, s=0.4 | acc=0.5265, loss=216.7400
[TEST] p=100, s=0.0 | acc=0.8679, loss=58.9364
[TEST] p=100, s=0.05 | acc=0.8582, loss=62.6850
[TEST] p=100, s=0.1 | acc=0.8385, loss=72.2005
[TEST] p=100, s=0.15 | acc=0.7968, loss=89.6279
[TEST] p=100, s=0.2 | acc=0.7256, loss=120.8690
[TEST] p=100, s=0.25 | acc=0.6475, loss=156.0175
[TEST] p=100, s=0.3 | acc=0.5643, loss=195.4279
[TEST] p=100, s=0.35 | acc=0.4873, loss=231.3366
[TEST] p=100, s=0.4 | acc=0.4209, loss=264.0759
=======================================================


=== GRID SEARCH RESULTS ===
LR=1e-5   | Train Acc=0.8205 | Val Acc=0.8194 | Test Acc=0.7438
LR=3e-5   | Train Acc=0.8521 | Val Acc=0.8422 | Test Acc=0.7672
LR=0.0001 | Train Acc=0.8845 | Val Acc=0.8640 | Test Acc=0.7808
LR=0.0003 | Train Acc=0.9072 | Val Acc=0.8728 | Test Acc=0.7864
LR=0.0010 | Train Acc=0.9044 | Val Acc=0.8764 | Test Acc=0.7786
